title,url,content,cleaned_content,sentiment,sentiment_category,vader_category,afinn_score,afinn_category,News_emotions
NewsNews,https://www.bbc.com/news/wales,"House prices in a Welsh county have fallen by more than 12% year-on-year, according to new figures. Tesni DeLuna has sold her custom design products to some of America's biggest stars.  Both the shadow secretary of state and Senedd group leader claim to lead the party in Wales. Wales will be at an ""economic disadvantage"" if it doesn't increase student numbers, sector warns. The non-hierarchical group live communally and are dedicated to sustainable living. Tesni DeLuna has sold her custom design products to some of America's biggest stars.  A firm which helped steelworkers retrain makes staff redundant after budget cuts. Mounted police and public order-trained officers were called to an incident in Cardiff city centre.  Both the shadow secretary of state and Senedd group leader claim to lead the party in Wales. James Howells claimed his ex-girlfriend threw out the hard drive, today worth £620m, in 2013.  Jason Redrup has needed to use CPR four times, although it's a skill few people expect to use. Olivia was 11 when she was first sexually harassed and it set the tone for the rest of her life. A judge found safety improvements were not good enough before two rail workers died at Port Talbot. Britain's Anna Morris breaks the individual pursuit world record twice in one day as she claims gold at the European Track Cycling Championships in Belgium. The mystery endures over which man with Welsh roots owned the island with a huge role in US history. Broadcast journalist Dan kept his film role a secret from everyone - including his own parents. The Manics new album Critical Thinking features the work of acclaimed photographer David Hurn. A bodybuilder and steroid user warns against taking the muscle-building drug. About 40 homes were evacuated, after a river of tip waste ran through the streets during Storm Bert. Tenants are refusing to leave an off-grid community amid plans to turn the farm into a retreat centre. Olivia Browne says sexual harassment can only be eradicated if men call each other out. Josh started scootering after a chance trip to RampWorld, Cardiff, when he was eight years old. Former Love Island contestant Tom Powell speaks about steroids after having breast tissue removed. Primary school pupils were crying in fear as the fire inched closer and closer to them. Mark Selby lifted his second Welsh Open title after beating Stephen Maguire 9-6 in the final at Venue Cymru, Llandudno. Wales' Elfyn Evans won Rally Sweden after a dramatic final day tussle with Toyota team-mate Takamoto Katsuta. Glasgow coach Franco Smith says he would like to return to international rugby after being linked with the Wales national job. Britain's Anna Morris breaks the individual pursuit world record twice in one day as she claims gold at the European Track Cycling Championships in Belgium. Team details and preview for Dragons' United Rugby Championship game against Glasgow Warriors on Sunday. Cwmni sydd wedi darparu cyrsiau sgiliau i weithwyr dur sydd wedi eu diswyddo ym Mhort Talbot wedi cau ei swyddfa'n y dref. Merfyn Davies - cyn-ohebydd Radio Cymru yn ardaloedd y gogledd ddwyrain wedi marw yn 87 oed. Cafodd Iwan Huws, prif leisydd y grŵp poblogaidd, Cowbois Rhos Botwnnog, ei daro'n wael tra'n perfformio y llynedd. Dwy sydd wedi cael profiadau o driniaethau IVF aflwyddiannus yn rhannu eu profiadau ""o siom a methiant"". Hanes Paige Morgan o ogledd America a ddysgodd Gymraeg ar ôl clywed cân gan Bendith. Tesni DeLuna has sold her custom design products to some of America's biggest stars.  House prices in a Welsh county have fallen by more than 12% year-on-year, according to new figures. Glasgow coach Franco Smith says he would like to return to international rugby after being linked with the Wales national job. Both the shadow secretary of state and Senedd group leader claim to lead the party in Wales. Wales will be at an ""economic disadvantage"" if it doesn't increase student numbers, sector warns. The non-hierarchical group live communally and are dedicated to sustainable living. James Howells claimed his ex-girlfriend threw out the hard drive, today worth £620m, in 2013.  Jason Redrup has needed to use CPR four times, although it's a skill few people expect to use. Tenants are refusing to leave an off-grid community amid plans to turn the farm into a retreat centre. Copyright 2025 BBC. All rights reserved.  The BBC is not responsible for the content of external sites. Read about our approach to external linking.  ",hous price welsh counti fallen yearonyear accord new figur tesni deluna sold custom design product america biggest star shadow secretari state senedd group leader claim lead parti wale wale econom disadvantag doesnt increas student number sector warn nonhierarch group live commun dedic sustain live tesni deluna sold custom design product america biggest star firm help steelwork retrain make staff redund budget cut mount polic public ordertrain offic call incid cardiff citi centr shadow secretari state senedd group leader claim lead parti wale jame howel claim exgirlfriend threw hard drive today worth jason redrup need use cpr four time although skill peopl expect use olivia first sexual harass set tone rest life judg found safeti improv good enough two rail worker die port talbot britain anna morri break individu pursuit world record twice one day claim gold european track cycl championship belgium mysteri endur man welsh root own island huge role u histori broadcast journalist dan kept film role secret everyon includ parent manic new album critic think featur work acclaim photograph david hurn bodybuild steroid user warn take musclebuild drug home evacu river tip wast ran street storm bert tenant refus leav offgrid commun amid plan turn farm retreat centr olivia brown say sexual harass erad men call josh start scooter chanc trip rampworld cardiff eight year old former love island contest tom powel speak steroid breast tissu remov primari school pupil cri fear fire inch closer closer mark selbi lift second welsh open titl beat stephen maguir final venu cymru llandudno wale elfyn evan ralli sweden dramat final day tussl toyota teammat takamoto katsuta glasgow coach franco smith say would like return intern rugbi link wale nation job britain anna morri break individu pursuit world record twice one day claim gold european track cycl championship belgium team detail preview dragon unit rugbi championship game glasgow warrior sunday cwmni sydd wedi darparu cyrsiau sgiliau weithwyr dur sydd wedi eu diswyddo ym mhort talbot wedi cau ei swyddfan dref merfyn davi cynohebydd radio cymru yn ardaloedd gogledd ddwyrain wedi marw yn o cafodd iwan huw prif leisydd grp poblogaidd cowboi rho botwnnog ei daron wael tran perfformio llynedd dwi sydd wedi cael profiadau driniaethau ivf aflwyddiannu yn rhannu eu profiadau siom methiant hane paig morgan ogledd america ddysgodd gymraeg ar l clyw cn gan bendith tesni deluna sold custom design product america biggest star hous price welsh counti fallen yearonyear accord new figur glasgow coach franco smith say would like return intern rugbi link wale nation job shadow secretari state senedd group leader claim lead parti wale wale econom disadvantag doesnt increas student number sector warn nonhierarch group live commun dedic sustain live jame howel claim exgirlfriend threw hard drive today worth jason redrup need use cpr four time although skill peopl expect use tenant refus leav offgrid commun amid plan turn farm retreat centr copyright bbc right reserv bbc respons content extern site read approach extern link,0.11896645021645019,Positive,Positive,-7.0,Negative,"{'Happy': 0.09, 'Angry': 0.04, 'Surprise': 0.33, 'Sad': 0.19, 'Fear': 0.35}"
NewsNews,https://www.bbc.com/news/wales/wales_politics,"House prices in a Welsh county have fallen by more than 12% year-on-year, according to new figures. Both the shadow secretary of state and Senedd group leader claim to lead the party in Wales. Lesley Griffiths becomes the ninth Labour MS to announce their intention to step down in 2026. Stuart Keyte becomes the first councillor in Wales to win a seat as part of the Reform party. Janet Finch-Saunders says she is ""baffled"" by comments made about her by the police chiefs. Both the shadow secretary of state and Senedd group leader claim to lead the party in Wales. A firm which helped steelworkers retrain makes staff redundant after budget cuts. Jess Hallett, who used to be anti-immigration, replicated immigrants' journeys to the UK. Lesley Griffiths becomes the ninth Labour MS to announce their intention to step down in 2026. About 40 homes were evacuated, after a river of tip waste ran through the streets during Storm Bert. The number of children waiting more than a year for neurodivergence assessments in Wales has doubled. Aneurin Bevan health board said it will take over the running of Brynmawr Medical Practice from March. She says a UK change to future funding support rules for Welsh agriculture is of ""huge concern"". Julie Morgan among eight of 30 Labour members leaving at next election. Copyright 2025 BBC. All rights reserved.  The BBC is not responsible for the content of external sites. Read about our approach to external linking.  ",hous price welsh counti fallen yearonyear accord new figur shadow secretari state senedd group leader claim lead parti wale lesley griffith becom ninth labour m announc intent step stuart keyt becom first councillor wale win seat part reform parti janet finchsaund say baffl comment made polic chief shadow secretari state senedd group leader claim lead parti wale firm help steelwork retrain make staff redund budget cut jess hallett use antiimmigr replic immigr journey uk lesley griffith becom ninth labour m announc intent step home evacu river tip wast ran street storm bert number child wait year neurodiverg assess wale doubl aneurin bevan health board said take run brynmawr medic practic march say uk chang futur fund support rule welsh agricultur huge concern juli morgan among eight labour member leav next elect copyright bbc right reserv bbc respons content extern site read approach extern link,0.30900974025974026,Positive,Positive,6.0,Positive,"{'Happy': 0.0, 'Angry': 0.0, 'Surprise': 0.3, 'Sad': 0.48, 'Fear': 0.22}"
NewsNews,https://www.bbc.com/news/world/africa,"Some people cheered as the fighters entered the city without resistance, two days after taking the airport. He was a pioneering figure who ran a mosque in Cape Town intended as a safe haven for gay Muslims. Uganda's Jacob Kiplimo shatters the half marathon record at a World Athletics event in Barcelona. The chief of defence staff was among those who were prevented from travelling to an official event.  A fraud and corruption case against Kwesi Nyantakyi, the former president of the Ghana Football Association, is dropped after a complex five-year legal battle. He was a pioneering figure who ran a mosque in Cape Town intended as a safe haven for gay Muslims. The collapse, which killed at least 40, took place near Kenieba, in Mali's gold-rich Kayes region. The population of the national bird is declining partly due to encroachment on wetlands by farmers. Uganda's Jacob Kiplimo shatters the half marathon record at a World Athletics event in Barcelona. Despite a US waiver allowing the resumption of humanitarian help, life-saving services have shut. Egyptian fencer Nada Hafez says it is important to tell women ""your body can surprise you"" after competing at the Paris Olympics while seven months pregnant. A selection of the week's best photos from across the African continent and beyond. The US president is ratcheting up pressure on South Africa over its domestic and foreign policy. The oil giant faces allegations it ignored warnings that a clean-up scheme was beset by corruption. Three men tell the BBC they have crossed the border multiple times to fight the military. M23 chief Sultani Makenga, wanted for war crimes, has fought as a rebel and a soldier in two countries. As a documentary about the military disaster is released the BBC speaks to some still affected. Mohamed Salah and Luis Diaz score as Liverpool hold on to beat Wolves and restore seven-point lead in Premier League. There is not much Erling Haaland has failed to do when it comes to scoring goals since he joined Manchester City, although none of his 11 hat-tricks have come quicker than Omar Marmoush's first for the club. Burnley midfielder Hannibal Mejbri accuses Preston forward Milutin Osmajic of racially abusing him during Saturday's Championship match at Deepdale. Former DR Congo captain Youssouf Mulumbu calls on Paris St-Germain to reconsider its Visit Rwanda deal amid the ongoing conflict and humanitarian crisis in his homeland. Days of heavy fighting between M23 rebels and DR Congo's army leave hospitals overwhelmed with patients. Ghana's MPs destroyed parliamentary property, including tables, microphones, sound equipment, and other items.  Rwanda and South Africa are launching rival bids to bring F1 racing back to Africa for the first time since 1993. Borussia Dortmund's Karim Adeyemi talks to BBC Sport Africa about his foundation and why he feels impelled to give back to Nigeria. East Africa's only rink is the one place in Nairobi where temperatures fall below 9C. Three essential stories to round off your working day. Explaining the news from Africa. One question to wake up to every weekday morning. One story from Africa, for Africa M23 rebels have made rapid advances in the latest bout of conflict that has long-dogged the mineral-rich east. Some people cheered as the fighters entered the city without resistance, two days after taking the airport. The collapse, which killed at least 40, took place near Kenieba, in Mali's gold-rich Kayes region. He was a pioneering figure who ran a mosque in Cape Town intended as a safe haven for gay Muslims. The population of the national bird is declining partly due to encroachment on wetlands by farmers. Residents in the Congolese city tell the BBC they are hiding in their homes as the rebels advance. The Rwandan-backed rebels' entry into Bukavu follows their capture of Goma, defying international calls for a ceasefire. Over 450 officials are off work without pay for failing to disclose their assets. A selection of the week's best photos from across the African continent and beyond. Copyright 2025 BBC. All rights reserved.  The BBC is not responsible for the content of external sites. Read about our approach to external linking.  ",peopl cheer fighter enter citi without resist two day take airport pioneer figur ran mosqu cape town intend safe gay muslim uganda jacob kiplimo shatter half marathon record world athlet event barcelona chief defenc staff among prevent travel offici event fraud corrupt case kwesi nyantakyi former presid ghana footbal associ drop complex fiveyear legal battl pioneer figur ran mosqu cape town intend safe gay muslim collaps kill least took place near kenieba mali goldrich kay region popul nation bird declin partli due encroach wetland farmer uganda jacob kiplimo shatter half marathon record world athlet event barcelona despit u waiver allow resumpt humanitarian help lifesav servic shut egyptian fencer nada hafez say import tell woman bodi surpris compet pari olymp seven month pregnant select week best photo across african contin beyond u presid ratchet pressur south africa domest foreign polici oil giant face alleg ignor warn cleanup scheme beset corrupt three men tell bbc cross border multipl time fight militari chief sultani makenga want war crime fought rebel soldier two countri documentari militari disast releas bbc speak still affect moham salah lui diaz score liverpool hold beat wolv restor sevenpoint lead premier leagu much erl haaland fail come score goal sinc join manchest citi although none hattrick come quicker omar marmoush first club burnley midfield hannib mejbri accus preston forward milutin osmaj racial abus saturday championship match deepdal former dr congo captain youssouf mulumbu call pari stgermain reconsid visit rwanda deal amid ongo conflict humanitarian crisi homeland day heavi fight rebel dr congo armi leav hospit overwhelm patient ghana mp destroy parliamentari properti includ tabl microphon sound equip item rwanda south africa launch rival bid bring f race back africa first time sinc borussia dortmund karim adeyemi talk bbc sport africa foundat feel impel give back nigeria east africa rink one place nairobi temperatur fall c three essenti stori round work day explain news africa one question wake everi weekday morn one stori africa africa rebel made rapid advanc latest bout conflict longdog mineralrich east peopl cheer fighter enter citi without resist two day take airport collaps kill least took place near kenieba mali goldrich kay region pioneer figur ran mosqu cape town intend safe gay muslim popul nation bird declin partli due encroach wetland farmer resid congoles citi tell bbc hide home rebel advanc rwandanback rebel entri bukavu follow captur goma defi intern call ceasefir offici work without pay fail disclos asset select week best photo across african contin beyond copyright bbc right reserv bbc respons content extern site read approach extern link,0.08401785714285714,Positive,Negative,-29.0,Negative,"{'Happy': 0.15, 'Angry': 0.22, 'Surprise': 0.07, 'Sad': 0.27, 'Fear': 0.3}"
NewsNews,https://www.bbc.com/news/world/asia,"Eyewitnesses and relatives of victims spoke of their pain and trauma after a crush at an overcrowded railway station claimed 18 lives. Two of India’s top visually impaired female athletes share the challenges of finding the perfect guide runner. Modi and Trump rekindle ties amid a global trade war, balancing tariffs, trade deals and strategic interests. A close-up look at Chinese projects that worry the White House. Hwang Ui-jo, who played for Nottingham Forest, was found guilty of illegally filming sexual encounters.  Two of India’s top visually impaired female athletes share the challenges of finding the perfect guide runner. Chloe Cheung was just a year out of school when Hong Kong police issued a million-dollar bounty for her arrest. The controversial ruling once again shines a spotlight on the issue of marital rape in India, which refuses to criminalise it. Modi and Trump rekindle ties amid a global trade war, balancing tariffs, trade deals and strategic interests. Police arrested her for ""criminal damage"" as the bun did not regain its shape and could not be sold. Trump and Modi, who share warm personal ties, met in the shadow of trade tensions complicating US-India relations. Biren Singh's resignation came almost two years after violence broke out in the north-eastern state.  The Japanese car making giants aimed to combine their businesses to compete against Chinese rivals. The plan comes after India said it would change its strict nuclear liability law. Thai Prime Minister Paetongtarn Shinawatra has pledged to close scam centres along the Thai-Myanmar border. Despite the high demand for domestic workers, they remain India's most vulnerable and exploited people. Some young people in China are finding that AI can offer the unexpected - emotional support US steel suppliers have just over a month to decide how to respond before the new tariffs take effect. Thousands of Indian-origin couples in the US are anxious over Trump's plan to end birthright citizenship. Officers appear to have rejected every application from former Afghan commandos who fought alongside them. Huge crowds gathered in Hong Kong to get a glimpse of Elder Sister and Little Brother
 Kim began her career as a child actor and was seen as one of the country's most promising actresses. Eyewitnesses and relatives of victims spoke of their pain and trauma after a crush at an overcrowded railway station claimed 18 lives. Eyewitnesses tell the BBC a ""huge crowd"" had gathered at the Indian capital's central train station. Two of India’s top visually impaired female athletes share the challenges of finding the perfect guide runner. Chloe Cheung was just a year out of school when Hong Kong police issued a million-dollar bounty for her arrest. The controversial ruling once again shines a spotlight on the issue of marital rape in India, which refuses to criminalise it. Police arrested her for ""criminal damage"" as the bun did not regain its shape and could not be sold. Copyright 2025 BBC. All rights reserved.  The BBC is not responsible for the content of external sites. Read about our approach to external linking.  ",eyewit rel victim spoke pain trauma crush overcrowd railway station claim live two india top visual impair femal athlet share challeng find perfect guid runner modi trump rekindl tie amid global trade war balanc tariff trade deal strateg interest closeup look chine project worri white hous hwang uijo play nottingham forest found guilti illeg film sexual encount two india top visual impair femal athlet share challeng find perfect guid runner chloe cheung year school hong kong polic issu milliondollar bounti arrest controversi rule shine spotlight issu marit rape india refus criminalis modi trump rekindl tie amid global trade war balanc tariff trade deal strateg interest polic arrest crimin damag bun regain shape could sold trump modi share warm person tie met shadow trade tension complic usindia relat biren singh resign came almost two year violenc broke northeastern state japanes car make giant aim combin busi compet chine rival plan come india said would chang strict nuclear liabil law thai prime minist paetongtarn shinawatra pledg close scam centr along thaimyanmar border despit high demand domest worker remain india vulner exploit peopl young peopl china find ai offer unexpect emot support u steel supplier month decid respond new tariff take effect thousand indianorigin coupl u anxiou trump plan end birthright citizenship offic appear reject everi applic former afghan commando fought alongsid huge crowd gather hong kong get glimps elder sister littl brother kim began career child actor seen one countri promis actress eyewit rel victim spoke pain trauma crush overcrowd railway station claim live eyewit tell bbc huge crowd gather indian capit central train station two india top visual impair femal athlet share challeng find perfect guid runner chloe cheung year school hong kong polic issu milliondollar bounti arrest controversi rule shine spotlight issu marit rape india refus criminalis polic arrest crimin damag bun regain shape could sold copyright bbc right reserv bbc respons content extern site read approach extern link,0.2259614578969418,Positive,Negative,-27.0,Negative,"{'Happy': 0.11, 'Angry': 0.02, 'Surprise': 0.39, 'Sad': 0.18, 'Fear': 0.3}"
