title,url,content,cleaned_content,sentiment,sentiment_category,vader_category,afinn_score,afinn_category,News_emotions
Panda-stic! Twin cubs attract hundreds of visitors on debut,https://www.bbc.com/news/videos/c4g7gd0vx5go,"Hong Kong's Ocean Park unveiled its new attraction to the public: twin panda cubs.  Huge crowds flocked to the theme park for the debut of the fluffy pair.  Their nicknames 'Elder Sister' and 'Little Brother' are only temporary. Hong Kong's residents have been taking part in a competition to name the duo.  Their mother, Ying Ying, is the world's oldest giant panda on record to give birth, delivering the twins just a day shy of her 19th birthday. The star was stopped from busking ahead of his concert in the southern Indian city of Bengaluru. The BBC visits Myanmar's Shwe Kokko, alleged to be a hub of fraud, money-laundering and human trafficking. It comes as Sheikh Hasina, who was ousted in protests last year, announced she would address the country via social media from India. Officials say the unlikely pair fell into the water when the tiger was chasing the boar. Vikas Pandey and Samira Hussain explain how the chaos unfolded in northern India.
 The surge happened when people who were sleeping on the riverbank were trampled by other pilgrims. Several people are feared killed in the crush at the Kumbh Mela, the world's largest religious gathering. Over a million people are camping out in the cold for a month on the banks of the Ganges river. Thai authorities make public transport in the capital free for one week, to try and tackle air pollution. The BBC spoke to couples who married at a Bangkok mall to ask what the legalisation means to them. The impeached president said he will comply with questioning to ""prevent unsavoury bloodshed."" Large crowds of critics and supporters of impeached President Yoon gathered outside his residence before his arrest.  The BBC's Samira Hussain describes what she saw at the world's largest religious gathering. The BBC is at the Mahakumbh Mela, the Hindu festival expected to draw 400 million visitors over six weeks. The 7.1 magnitude quake killed scores of people in the mountainous region, with many more injured. Backers of Yoon Suk Yeol waved signs reading ""stop the steal"", as police called off an attempted arrest. The rocket, which took off from a site north of Chennai, places two satellites in orbit. The BBC's Jean Mackenzie speaks to bereaved relatives waiting to know more about the Jeju Air crash. The BBC's Asia correspondent visited the scene, where investigators are sifting through the fuselage. The Jeju Air flight landing at Muan Airport had 181 passengers on board when it crashed off the runway. Copyright 2025 BBC. All rights reserved.  The BBC is not responsible for the content of external sites. Read about our approach to external linking.  ",hong kong ocean park unveil new attract public twin panda cub huge crowd flock theme park debut fluffi pair nicknam elder sister littl brother temporari hong kong resid take part competit name duo mother ying ying world oldest giant panda record give birth deliv twin day shi th birthday star stop busk ahead concert southern indian citi bengaluru bbc visit myanmar shwe kokko alleg hub fraud moneylaund human traffick come sheikh hasina oust protest last year announc would address countri via social medium india offici say unlik pair fell water tiger chase boar vika pandey samira hussain explain chao unfold northern india surg happen peopl sleep riverbank trampl pilgrim sever peopl fear kill crush kumbh mela world largest religi gather million peopl camp cold month bank gang river thai author make public transport capit free one week tri tackl air pollut bbc spoke coupl marri bangkok mall ask legalis mean impeach presid said compli question prevent unsavouri bloodsh larg crowd critic support impeach presid yoon gather outsid resid arrest bbc samira hussain describ saw world largest religi gather bbc mahakumbh mela hindu festiv expect draw million visitor six week magnitud quak kill score peopl mountain region mani injur backer yoon suk yeol wave sign read stop steal polic call attempt arrest rocket took site north chennai place two satellit orbit bbc jean mackenzi speak bereav rel wait know jeju air crash bbc asia correspond visit scene investig sift fuselag jeju air flight land muan airport passeng board crash runway copyright bbc right reserv bbc respons content extern site read approach extern link,0.016194083694083695,Positive,Negative,-25.0,Negative,"{'Happy': 0.08, 'Angry': 0.08, 'Surprise': 0.21, 'Sad': 0.11, 'Fear': 0.53}"
The A-level student who became an enemy of the Chinese state,https://www.bbc.com/news/articles/c93lp2wd0qzo,"Just over a year ago, Chloe Cheung was sitting her A-levels. Now she's on a Chinese government list of wanted dissidents. The choir girl-turned-democracy activist woke up to news in December that police in Hong Kong had issued a $HK1 million ($100,000; £105,000) reward for information leading to her capture abroad. ""I actually just wanted to take a gap year after school,"" Chloe, 19, who lives in London, told the BBC. ""But I've ended up with a bounty!"" Chloe is the youngest of 19 activists accused of breaching a national security law introduced by Beijing in response to huge pro-democracy protests in the former British colony five years ago. In 2021, she and her family moved to the UK under a special visa scheme for Hong Kongers. She can probably never return to her home city and says she has to be careful about where she travels. Her protest work has made her a fugitive of the Chinese state, a detail not lost on me as we meet one icy morning in the café in the crypt of Westminster Abbey. In medieval England, churches provided sanctuary from arrest. Hong Kong police issued the arrest warrant on Christmas Eve, using the only photo they appear to have on file for her – in which she is aged 11. ""It freaked me out at first,"" she says, but then she fired back a public response. ""I didn't want the government to think I was scared. Because if Hong Kongers in Hong Kong can't speak out for themselves any more, then we outside of the city - who can speak freely without fear- we have to speak up for them."" Chloe attended her first protests with her school friends, in the early days of Hong Kong's 2019 demonstrations. Protesters turned out in huge numbers against a bill seen as extending China's control over the territory, which had enjoyed semi-autonomy since Britain handed it back in 1997. ""Politics were never in my life before… so I went to the first protest with curiosity,"" she said. She saw police tear-gassing demonstrators and an officer stepping on a protester's neck. ""I was so shocked,"" she says. ""That moment actually changed how I looked at the world."" Growing up in a city that was part of China but that had retained many of its freedoms – she had thought Hong Kongers could talk about ""what we like and don't like"" and  ""could decide what Hong Kong's future looked like"". But the violent crackdown by authorities made her realise that wasn't the case. She began joining protests, at first without her parents' knowledge. ""I didn't tell them at the time because they didn't care [about politics],"" she says. But when things started to get ""really crazy"",  she browbeat her parents into coming with her. At the march, police fired tear gas at them and they had to run away into the subway. Her parents got the ""raw experience"", she says, not the version they'd seen blaming protesters on TV. After months of demonstrations, Beijing passed the National Security Law in 2020. Suddenly, most of the freedoms that had set Hong Kong apart from mainland China - freedom of expression, the right to political assemblies – were gone. Symbols of democracy in the city, including statues and independent newspapers, were torn down, shut or erased. Those publicly critical of the government - from teachers to millionaire moguls like British citizen Jimmy Lai - faced trials and eventually, jail. In response to the crackdown, the UK opened its doors to Hong Kongers under a new scheme, the British National Overseas (BNO) visa. Chloe's family were some of the first to take up the offer, settling in Leeds, which offered the cheapest Airbnb they could find. Chloe had to do her GCSEs halfway through the school term, and during a pandemic lockdown. At first, she felt isolated. It was hard to make friends and she had trouble speaking English, she says. There were few other Hong Kongers around. Unable to afford international student fees of more than £20,000 a year, she took a job with the Committee for Freedom in Hong Kong Foundation, a pro-democracy NGO. When China started putting bounties on dissidents' heads in 2023, they targeted prominent protest leaders and opposition politicians. Chloe, still finishing her A-levels at the time, thought was she too small-fry to ever be a target. Her inclusion underlines Beijing's determination to pursue activists overseas. The bounty puts a target on her back and encourages third parties to report on her actions in the UK, she says. China has been the leading country over the past decade trying to silence exiled dissidents around the world, according to a report this week.  Another Hong Kong dissident who reported being assaulted in London blamed the attacks on Chinese government-linked actors. And last May, British police charged three men with gathering intelligence for Hong Kong and breaking into a home. One of the men was soon after found dead in unclear circumstances. ""They're only interested in Hong Kongers because they want to scare off others,"" Chloe says. She says many of those who've moved over in recent years stay quiet, partly because they still have family in Hong Kong. ""Most of the BNO visa holders told me this because they don't want to take risks,"" she says. ""It's sad but we can't blame them."" On the day her arrest warrant was announced, Foreign Secretary David Lammy said the UK would not tolerate ""any attempts by foreign governments to coerce, intimidate, harass or harm their critics overseas"". He added the government was committed to supporting Hong Kongers in the UK. But more needs to be done, says Chloe, who's spent the first weeks of this year lobbying Westminster. In the past fortnight she has met Prime Minister Keir Starmer at a Lunar New Year event at Downing Street, and shadow foreign secretary Priti Patel, who later tweeted: ""We must not give an inch to any transnational repression in the UK.""  But she worries whether the UK's recent overtures to China could mean fewer protections for Hong Kongers. ""We just don't know what will happen to us, and whether the British government will protect us if they really want to protect their trade relationship with China."" Does she feel scared on the streets in London? It's not as bad as what activists back home face, she says.  ""When I think of what [they] face… it's actually not that big a deal that I got a bounty overseas."" Bounty targets Huge crowds gathered in Hong Kong to get a glimpse of Elder Sister and Little Brother
 Provides an overview Hong Kong and key facts about this region of China. Solihull council says the borough's 5,000 Hongkonger residents ""enrich all our lives"". The police say they will give HK$1m to people who can help them find those accused of breaching security laws. One man spent over 45 minutes to win a waffle maker but walked away instead with a handful of trinkets. Copyright 2025 BBC. All rights reserved.  The BBC is not responsible for the content of external sites. Read about our approach to external linking.  ",year ago chloe cheung sit alevel she chine govern list want dissid choir girlturneddemocraci activist woke news decemb polic hong kong issu hk million reward inform lead captur abroad actual want take gap year school chloe live london told bbc ive end bounti chloe youngest activist accus breach nation secur law introduc beij respons huge prodemocraci protest former british coloni five year ago famili move uk special visa scheme hong konger probabl never return home citi say care travel protest work made fugit chine state detail lost meet one ici morn caf crypt westminst abbey mediev england church provid sanctuari arrest hong kong polic issu arrest warrant christma eve use photo appear file age freak first say fire back public respons didnt want govern think scare hong konger hong kong cant speak outsid citi speak freeli without fear speak chloe attend first protest school friend earli day hong kong demonstr protest turn huge number bill seen extend china control territori enjoy semiautonomi sinc britain hand back polit never life went first protest curio said saw polic teargas demonstr offic step protest neck shock say moment actual chang look world grow citi part china retain mani freedom thought hong konger could talk like dont like could decid hong kong futur look like violent crackdown author made realis wasnt case began join protest first without parent knowledg didnt tell time didnt care polit say thing start get realli crazi browbeat parent come march polic fire tear ga run away subway parent got raw experi say version theyd seen blame protest tv month demonstr beij pas nation secur law suddenli freedom set hong kong apart mainland china freedom express right polit assembl gone symbol democraci citi includ statu independ newspap torn shut era publicli critic govern teacher millionair mogul like british citizen jimmi lai face trial eventu jail respons crackdown uk open door hong konger new scheme british nation oversea bno visa chloe famili first take offer settl leed offer cheapest airbnb could find chloe gcse halfway school term pandem lockdown first felt isol hard make friend troubl speak english say hong konger around unabl afford intern student fee year took job committe freedom hong kong foundat prodemocraci ngo china start put bounti dissid head target promin protest leader opposit politician chloe still finish alevel time thought smallfri ever target inclus underlin beij determin pursu activist oversea bounti put target back encourag third parti report action uk say china lead countri past decad tri silenc exil dissid around world accord report week anoth hong kong dissid report assault london blame attack chine governmentlink actor last may british polic charg three men gather intellig hong kong break home one men soon found dead unclear circumst theyr interest hong konger want scare other chloe say say mani whove move recent year stay quiet partli still famili hong kong bno visa holder told dont want take risk say sad cant blame day arrest warrant announc foreign secretari david lammi said uk would toler attempt foreign govern coerc intimid harass harm critic oversea ad govern commit support hong konger uk need done say chloe who spent first week year lobbi westminst past fortnight met prime minist keir starmer lunar new year event down street shadow foreign secretari priti patel later tweet must give inch transnat repress uk worri whether uk recent overtur china could mean fewer protect hong konger dont know happen u whether british govern protect u realli want protect trade relationship china feel scare street london bad activist back home face say think face actual big deal got bounti oversea bounti target huge crowd gather hong kong get glimps elder sister littl brother provid overview hong kong key fact region china solihul council say borough hongkong resid enrich live polic say give hkm peopl help find accus breach secur law one man spent minut win waffl maker walk away instead hand trinket copyright bbc right reserv bbc respons content extern site read approach extern link,0.016930226891164395,Positive,Positive,-35.0,Negative,"{'Happy': 0.12, 'Angry': 0.07, 'Surprise': 0.12, 'Sad': 0.29, 'Fear': 0.4}"
"Austria attack that killed teen linked to IS, officials say",https://www.bbc.com/news/articles/cjw4jj0p5jdo,"A stabbing in Austria that killed a 14-year-old boy and wounded five others was an Islamist attack, Austrian officials have said.  The attack took place on Saturday at Villach, a town near the border with Italy and Slovenia, and three of those who were injured remain in intensive care, authorities said.  A 23-year-old Syrian asylum seeker, who was detained at the scene, has been charged with murder and attempted murder.   Interior Minister Gerhard Karner said an Islamic State group flag had been found in the suspect's apartment, while state police chief Michaela Kohlweiss said he had sworn allegiance to the group. Speaking at a news conference on Sunday, Karner said this was an ""Islamist attack with IS links by an attacker who, according to the investigations so far, was obviously radicalised online, via the internet, within a very short space of time"".  ""So those in a position of responsibility, the police, the authorities, must draw the necessary conclusions from that."" Karner said the suspect had a valid residence permit, no criminal record, and had not previously attracted the attention of authorities.  Authorities previously said the suspect had a temporary residence permit and was waiting for a decision on his asylum application. The attack took place around 16:00 local time (15:00 GMT) near the town's main square.  On Sunday, officials confirmed the ages of those who were injured: Two 15-year-olds, with the other victims aged 28, 32 and 36. Five of them are Austrian nationals and one is Turkish. Three are in intensive care, one is in a stable condition and another is receiving outpatient treatment. A delivery worker, also a Syrian man, who had driven his vehicle at the attacker helped prevent more injuries, police said. The attack comes amid a national debate over asylum laws and an election last year that saw the far-right Freedom Party come out on top for the first time. The party has failed to form a coalition government, leaving Austria's President Alexander Van der Bellen weighing up whether to call a snap election, form a minority government or invite other parties or a group of experts to try and form an administration. Herbert Kickl, the head of the Freedom Party, seized on the Villach attack, saying on Saturday that Austria needs a ""rigorous crackdown on asylum"". On Sunday, Karner said there needed to be ""legal reforms"" for police and authorities and called for screenings of certain groups, such as asylum seekers from Syria and Afghanistan.  Copyright 2025 BBC. All rights reserved.  The BBC is not responsible for the content of external sites. Read about our approach to external linking.  ",stab austria kill yearold boy wound five other islamist attack austrian offici said attack took place saturday villach town near border itali slovenia three injur remain intens care author said yearold syrian asylum seeker detain scene charg murder attempt murder interior minist gerhard karner said islam state group flag found suspect apart state polic chief michaela kohlweiss said sworn allegi group speak news confer sunday karner said islamist attack link attack accord investig far obvious radicalis onlin via internet within short space time posit respons polic author must draw necessari conclus karner said suspect valid resid permit crimin record previous attract attent author author previous said suspect temporari resid permit wait decis asylum applic attack took place around local time gmt near town main squar sunday offici confirm age injur two yearold victim age five austrian nation one turkish three intens care one stabl condit anoth receiv outpati treatment deliveri worker also syrian man driven vehicl attack help prevent injuri polic said attack come amid nation debat asylum law elect last year saw farright freedom parti come top first time parti fail form coalit govern leav austria presid alexand van der bellen weigh whether call snap elect form minor govern invit parti group expert tri form administr herbert kickl head freedom parti seiz villach attack say saturday austria need rigor crackdown asylum sunday karner said need legal reform polic author call screen certain group asylum seeker syria afghanistan copyright bbc right reserv bbc respons content extern site read approach extern link,0.11587301587301586,Positive,Negative,-13.0,Negative,"{'Happy': 0.0, 'Angry': 0.13, 'Surprise': 0.33, 'Sad': 0.17, 'Fear': 0.37}"
